<?xml version="1.0" encoding="UTF-8"?>
<Planets xmlns="solsys" xmlns:xsi="http://www.w3.org/2001/XMLSchema-instance" xsi:schemaLocation="solsys.xsd">
	<Planet>
		<PlanetName>Sun</PlanetName>
		<PlanetColor red="255" green="255" blue="0"/>
		<TrueAnamoly>0.0</TrueAnamoly>
		<PerihelionAngle>0.0</PerihelionAngle>
		<Obliquity>0.0</Obliquity>
		<RotationalPeriod>0.0</RotationalPeriod>
		<MeanAnamoly0>0.0</MeanAnamoly0>
		<MeanAnamoly>0.0</MeanAnamoly>
		<Dm>0.0</Dm>
		<Radius>6.96E8</Radius>
		<Oblateness>0.0</Oblateness>
		<ArgOfPerhelion>0.0</ArgOfPerhelion>
		<Atmo>false</Atmo>
		<SemiMajorAxis>0.0</SemiMajorAxis>
		<Period>0.0</Period>
		<Eccentricity>0.0</Eccentricity>
		<Inclination>0.0</Inclination>
		<AscendingNode>0.0</AscendingNode>
		<EpochLongitude>0.0</EpochLongitude>
		<Mass>1.99E30</Mass>
	</Planet>
	<Planet>
		<PlanetName>Mercury</PlanetName>
		<PlanetColor red="145" green="147" blue="153"/>
		<TrueAnamoly>0.0</TrueAnamoly>
		<PerihelionAngle>77.46</PerihelionAngle>
		<Obliquity>0.1</Obliquity>
		<RotationalPeriod>1407.5</RotationalPeriod>
		<MeanAnamoly0>168.6562</MeanAnamoly0>
		<MeanAnamoly>0.0</MeanAnamoly>
		<Dm>4.0923343</Dm>
		<Radius>2430000.0</Radius>
		<Oblateness>0.0</Oblateness>
		<ArgOfPerhelion>29.128693</ArgOfPerhelion>
		<Atmo>false</Atmo>
		<SemiMajorAxis>5.7909035E10</SemiMajorAxis>
		<Period>1.39354015E16</Period>
		<Eccentricity>0.205635</Eccentricity>
		<Inclination>7.0047</Inclination>
		<AscendingNode>48.3313</AscendingNode>
		<EpochLongitude>252.3</EpochLongitude>
		<Mass>3.18E23</Mass>
	</Planet>
	<Planet>
		<PlanetName>Venus</PlanetName>
		<PlanetColor red="234" green="239" blue="197"/>
		<TrueAnamoly>0.0</TrueAnamoly>
		<PerihelionAngle>131.6</PerihelionAngle>
		<Obliquity>177.4</Obliquity>
		<RotationalPeriod>5832.5</RotationalPeriod>
		<MeanAnamoly0>48.0052</MeanAnamoly0>
		<MeanAnamoly>0.0</MeanAnamoly>
		<Dm>1.6021302</Dm>
		<Radius>6060000.0</Radius>
		<Oblateness>0.0</Oblateness>
		<ArgOfPerhelion>54.920105</ArgOfPerhelion>
		<Atmo>true</Atmo>
		<SemiMajorAxis>1.08208628E11</SemiMajorAxis>
		<Period>3.55953146E16</Period>
		<Eccentricity>0.006773</Eccentricity>
		<Inclination>3.3946</Inclination>
		<AscendingNode>76.6799</AscendingNode>
		<EpochLongitude>182.0</EpochLongitude>
		<Mass>4.88E24</Mass>
	</Planet>
	<Planet>
		<PlanetName>Earth</PlanetName>
		<PlanetColor red="60" green="151" blue="219"/>
		<TrueAnamoly>0.0</TrueAnamoly>
		<PerihelionAngle>102.9</PerihelionAngle>
		<Obliquity>23.439281</Obliquity>
		<RotationalPeriod>23.9345</RotationalPeriod>
		<MeanAnamoly0>356.047</MeanAnamoly0>
		<MeanAnamoly>0.0</MeanAnamoly>
		<Dm>0.98560023</Dm>
		<Radius>6370000.0</Radius>
		<Oblateness>0.0</Oblateness>
		<ArgOfPerhelion>102.899994</ArgOfPerhelion>
		<Atmo>true</Atmo>
		<SemiMajorAxis>1.4959788E11</SemiMajorAxis>
		<Period>5.7861297E16</Period>
		<Eccentricity>0.016709</Eccentricity>
		<Inclination>0.0</Inclination>
		<AscendingNode>0.0</AscendingNode>
		<EpochLongitude>100.5</EpochLongitude>
		<Mass>5.98E24</Mass>
	</Planet>
	<Planet>
		<PlanetName>Mars</PlanetName>
		<PlanetColor red="223" green="126" blue="55"/>
		<TrueAnamoly>0.0</TrueAnamoly>
		<PerihelionAngle>336.1</PerihelionAngle>
		<Obliquity>25.19</Obliquity>
		<RotationalPeriod>24.623</RotationalPeriod>
		<MeanAnamoly0>18.6021</MeanAnamoly0>
		<MeanAnamoly>0.0</MeanAnamoly>
		<Dm>0.5240208</Dm>
		<Radius>3370000.0</Radius>
		<Oblateness>0.0</Oblateness>
		<ArgOfPerhelion>286.5426</ArgOfPerhelion>
		<Atmo>true</Atmo>
		<SemiMajorAxis>2.27940467E11</SemiMajorAxis>
		<Period>1.08825873E17</Period>
		<Eccentricity>0.093405</Eccentricity>
		<Inclination>1.8497</Inclination>
		<AscendingNode>49.5574</AscendingNode>
		<EpochLongitude>355.4</EpochLongitude>
		<Mass>6.42E23</Mass>
	</Planet>
	<Planet>
		<PlanetName>Jupiter</PlanetName>
		<PlanetColor red="239" green="193" blue="160"/>
		<TrueAnamoly>0.0</TrueAnamoly>
		<PerihelionAngle>14.3</PerihelionAngle>
		<Obliquity>3.12</Obliquity>
		<RotationalPeriod>9.925</RotationalPeriod>
		<MeanAnamoly0>19.895</MeanAnamoly0>
		<MeanAnamoly>0.0</MeanAnamoly>
		<Dm>0.08380853</Dm>
		<Radius>6.99E7</Radius>
		<Oblateness>0.05</Oblateness>
		<ArgOfPerhelion>273.8458</ArgOfPerhelion>
		<Atmo>true</Atmo>
		<SemiMajorAxis>7.7829184E11</SemiMajorAxis>
		<Period>6.8661567E17</Period>
		<Eccentricity>0.048498</Eccentricity>
		<Inclination>1.303</Inclination>
		<AscendingNode>100.4542</AscendingNode>
		<EpochLongitude>34.4</EpochLongitude>
		<Mass>1.9E27</Mass>
	</Planet>
	<Planet>
		<PlanetName>Saturn</PlanetName>
		<PlanetColor red="232" green="228" blue="168"/>
		<TrueAnamoly>0.0</TrueAnamoly>
		<PerihelionAngle>93.1</PerihelionAngle>
		<Obliquity>26.73</Obliquity>
		<RotationalPeriod>10.656</RotationalPeriod>
		<MeanAnamoly0>316.967</MeanAnamoly0>
		<MeanAnamoly>0.0</MeanAnamoly>
		<Dm>0.03344423</Dm>
		<Radius>5.85E7</Radius>
		<Oblateness>0.05</Oblateness>
		<ArgOfPerhelion>339.43658</ArgOfPerhelion>
		<Atmo>true</Atmo>
		<SemiMajorAxis>1.42937031E12</SemiMajorAxis>
		<Period>1.70890193E18</Period>
		<Eccentricity>0.055546</Eccentricity>
		<Inclination>2.4886</Inclination>
		<AscendingNode>113.6634</AscendingNode>
		<EpochLongitude>50.1</EpochLongitude>
		<Mass>5.68E26</Mass>
	</Planet>
	<Planet>
		<PlanetName>Uranus</PlanetName>
		<PlanetColor red="182" green="209" blue="218"/>
		<TrueAnamoly>0.0</TrueAnamoly>
		<PerihelionAngle>170.6617</PerihelionAngle>
		<Obliquity>97.86</Obliquity>
		<RotationalPeriod>17.24</RotationalPeriod>
		<MeanAnamoly0>142.5905</MeanAnamoly0>
		<MeanAnamoly>0.0</MeanAnamoly>
		<Dm>0.011725806</Dm>
		<Radius>2.33E7</Radius>
		<Oblateness>0.0</Oblateness>
		<ArgOfPerhelion>96.661194</ArgOfPerhelion>
		<Atmo>true</Atmo>
		<SemiMajorAxis>2.86954278E12</SemiMajorAxis>
		<Period>4.8609266E18</Period>
		<Eccentricity>0.047318</Eccentricity>
		<Inclination>0.7733</Inclination>
		<AscendingNode>74.0005</AscendingNode>
		<EpochLongitude>314.1</EpochLongitude>
		<Mass>8.68E25</Mass>
	</Planet>
	<Planet>
		<PlanetName>Neptune</PlanetName>
		<PlanetColor red="123" green="172" blue="176"/>
		<TrueAnamoly>0.0</TrueAnamoly>
		<PerihelionAngle>48.1</PerihelionAngle>
		<Obliquity>29.56</Obliquity>
		<RotationalPeriod>16.11</RotationalPeriod>
		<MeanAnamoly0>260.2471</MeanAnamoly0>
		<MeanAnamoly>0.0</MeanAnamoly>
		<Dm>0.005995147</Dm>
		<Radius>2.21E7</Radius>
		<Oblateness>0.0</Oblateness>
		<ArgOfPerhelion>276.3194</ArgOfPerhelion>
		<Atmo>true</Atmo>
		<SemiMajorAxis>4.4966515E12</SemiMajorAxis>
		<Period>9.535288E18</Period>
		<Eccentricity>0.008606</Eccentricity>
		<Inclination>1.77</Inclination>
		<AscendingNode>131.7806</AscendingNode>
		<EpochLongitude>304.3</EpochLongitude>
		<Mass>1.03E26</Mass>
	</Planet>
	<Planet>
		<PlanetName>Pluto</PlanetName>
		<PlanetColor red="255" green="255" blue="255"/>
		<TrueAnamoly>0.0</TrueAnamoly>
		<PerihelionAngle>224.0668</PerihelionAngle>
		<Obliquity>119.6</Obliquity>
		<RotationalPeriod>153.29</RotationalPeriod>
		<MeanAnamoly0>14.704</MeanAnamoly0>
		<MeanAnamoly>0.0</MeanAnamoly>
		<Dm>0.003975571</Dm>
		<Radius>1500000.0</Radius>
		<Oblateness>0.0</Oblateness>
		<ArgOfPerhelion>113.763306</ArgOfPerhelion>
		<Atmo>false</Atmo>
		<SemiMajorAxis>5.9063764E12</SemiMajorAxis>
		<Period>1.4354289E19</Period>
		<Eccentricity>0.248808</Eccentricity>
		<Inclination>17.14175</Inclination>
		<AscendingNode>110.3035</AscendingNode>
		<EpochLongitude>0.0</EpochLongitude>
		<Mass>1.4E22</Mass>
	</Planet>
</Planets>
